[
  {"id":"defect-001","category":"defect","title":"Code violates current contract","severity":"high","origin":"synthetic","input":{"prompt":"The current contract says replay must be deterministic, but the implementation produces different object order across runs.","context":["The specification is internally consistent.","The deterministic oracle reproduces the mismatch."]},"expected":{"status":"BLOCKED_IMPLEMENTATION","earliest_untrusted_layer":"implementation","start_stage":"P35","required_stages":["P35","P36"],"forbidden_stages":["P23"],"authority_classification":[],"defect_classification":"IMPLEMENTATION_DEFECT","gate_verdict":null,"required_findings":["Fix the implementation and rerun the deterministic evidence."],"forbidden_findings":["Change the contract to match the nondeterministic implementation."]},"tags":["implementation-defect","determinism"]},
  {"id":"defect-002","category":"defect","title":"Specification is internally contradictory","severity":"critical","origin":"synthetic","input":{"prompt":"One current section says deletes are idempotent, another says repeating the same delete must fail. The code has not been written yet.","context":["Both rules are inside the same current specification."]},"expected":{"status":"BLOCKED_AUTHORITY","earliest_untrusted_layer":"operation","start_stage":"P35","required_stages":["P35","P21"],"forbidden_stages":["P32","P36"],"authority_classification":[],"defect_classification":"SPEC_DEFECT","gate_verdict":null,"required_findings":["Resolve the specification before implementation begins."],"forbidden_findings":["Let the implementation choose one interpretation."]},"tags":["spec-defect","contradiction","critical"]},
  {"id":"defect-003","category":"defect","title":"Test encodes the wrong current behavior","severity":"high","origin":"synthetic","input":{"prompt":"The implementation and current spec agree, but a unit test still expects a behavior removed by an accepted authority change.","context":["Supersession is complete."]},"expected":{"status":"BLOCKED_EVIDENCE","earliest_untrusted_layer":"verification","start_stage":"P35","required_stages":["P35","P36"],"forbidden_stages":["P32"],"authority_classification":[],"defect_classification":"TEST_DEFECT","gate_verdict":null,"required_findings":["Repair the test or oracle so it represents current authority."],"forbidden_findings":["Modify correct implementation to satisfy stale evidence."]},"tags":["test-defect","verification"]},
  {"id":"defect-004","category":"defect","title":"Toolchain outage is an environment defect","severity":"normal","origin":"synthetic","input":{"prompt":"The required Apple platform verification cannot run because the signing service is unavailable. No code or spec failure has been observed.","context":["The failure is external to the implementation."]},"expected":{"status":"BLOCKED_ENVIRONMENT","earliest_untrusted_layer":"verification","start_stage":"P35","required_stages":["P35"],"forbidden_stages":["P23","P32"],"authority_classification":[],"defect_classification":"ENVIRONMENT_DEFECT","gate_verdict":null,"required_findings":["Restore or replace the environment before claiming the verification result."],"forbidden_findings":["Treat the unavailable platform test as passed."]},"tags":["environment","platform"]},
  {"id":"defect-005","category":"defect","title":"Missing upstream artifact is a dependency blocker","severity":"normal","origin":"synthetic","input":{"prompt":"Task B cannot start because Task A has not produced the required generated descriptor artifact.","context":["Task B authority is otherwise complete."]},"expected":{"status":"BLOCKED_MISSING_INPUT","earliest_untrusted_layer":"implementation","start_stage":"P35","required_stages":["P35"],"forbidden_stages":["P21","P32"],"authority_classification":[],"defect_classification":"DEPENDENCY_BLOCKER","gate_verdict":null,"required_findings":["Wait for or restore the required upstream artifact rather than redesigning the task."],"forbidden_findings":["Reinvent the missing artifact inside Task B."]},"tags":["dependency","task-graph"]},
  {"id":"defect-006","category":"defect","title":"Open design choice is an unresolved decision","severity":"high","origin":"synthetic","input":{"prompt":"The platform contract intentionally leaves the Android surface ownership model undecided, but implementation needs that decision now.","context":["The decision is explicitly marked open and affects lifecycle semantics."]},"expected":{"status":"BLOCKED_UNRESOLVED_DECISION","earliest_untrusted_layer":"platform","start_stage":"P35","required_stages":["P35","P17"],"forbidden_stages":["P32","P36"],"authority_classification":[],"defect_classification":"UNRESOLVED_DECISION","gate_verdict":null,"required_findings":["Close the platform decision before implementation treats one option as authoritative."],"forbidden_findings":["Choose whichever platform pattern is easiest to code."]},"tags":["unresolved-decision","platform"]}
]
