[
  {"id":"gate-001","category":"gate","title":"All required authority and evidence pass","severity":"normal","origin":"synthetic","input":{"prompt":"Audit this implementation gate.","context":["Current authority is unambiguous.","All required automated tests pass.","Required golden and performance evidence are present.","No exit criterion is missing."]},"expected":{"status":"READY","earliest_untrusted_layer":null,"start_stage":"P34","required_stages":["P34"],"forbidden_stages":[],"authority_classification":[],"defect_classification":null,"gate_verdict":"PASS","required_findings":["Gate evidence satisfies current exit criteria."],"forbidden_findings":[]},"tags":["gate","pass"]},
  {"id":"gate-002","category":"gate","title":"Missing required golden blocks despite passing unit tests","severity":"critical","origin":"synthetic","input":{"prompt":"Audit this gate. Compilation and 120 unit tests pass.","context":["Verification authority requires a reviewed golden corpus.","The golden corpus is missing."]},"expected":{"status":"BLOCKED_EVIDENCE","earliest_untrusted_layer":"verification","start_stage":"P34","required_stages":["P34"],"forbidden_stages":[],"authority_classification":[],"defect_classification":"EVIDENCE_GAP","gate_verdict":"BLOCKED_EVIDENCE","required_findings":["Passing unit tests do not substitute for the required golden evidence."],"forbidden_findings":["PASS","PASS_WITH_FINDINGS"]},"tags":["gate","evidence-gap","critical"]},
  {"id":"gate-003","category":"gate","title":"Execution plan drift blocks authority even when code passes","severity":"critical","origin":"synthetic","input":{"prompt":"Audit this gate. The code compiles and tests pass, but the implementation plan used an old architecture version.","context":["Current architecture is v0.4.","The execution package still points to superseded v0.3."]},"expected":{"status":"BLOCKED_AUTHORITY","earliest_untrusted_layer":"authority","start_stage":"P34","required_stages":["P34","P23"],"forbidden_stages":[],"authority_classification":["Current Authority: v0.4","Superseded execution dependency: v0.3"],"defect_classification":"AUTHORITY_CONFLICT","gate_verdict":"BLOCKED_AUTHORITY","required_findings":["Successful compilation cannot prove conformance to an execution package based on superseded authority."],"forbidden_findings":["PASS","PASS_WITH_FINDINGS"]},"tags":["gate","authority-drift","critical"]},
  {"id":"gate-004","category":"gate","title":"Known contract violation blocks implementation","severity":"critical","origin":"synthetic","input":{"prompt":"Audit this gate. Most tests pass, but differential replay shows one canonical-state divergence.","context":["The invariant requires zero divergence."]},"expected":{"status":"BLOCKED_IMPLEMENTATION","earliest_untrusted_layer":"implementation","start_stage":"P34","required_stages":["P34","P35","P36"],"forbidden_stages":[],"authority_classification":[],"defect_classification":"IMPLEMENTATION_DEFECT","gate_verdict":"BLOCKED_IMPLEMENTATION","required_findings":["A single violation of a zero-divergence invariant blocks the gate."],"forbidden_findings":["PASS_WITH_FINDINGS"]},"tags":["gate","implementation-defect","critical"]},
  {"id":"gate-005","category":"gate","title":"Required platform evidence unavailable blocks environment","severity":"high","origin":"synthetic","input":{"prompt":"Audit release gate evidence. Windows and Android pass, but the required Apple device run could not execute because the lab is unavailable.","context":["Apple device evidence is an explicit exit criterion.","No evidence proves pass or fail on Apple."]},"expected":{"status":"BLOCKED_ENVIRONMENT","earliest_untrusted_layer":"verification","start_stage":"P34","required_stages":["P34"],"forbidden_stages":[],"authority_classification":[],"defect_classification":"ENVIRONMENT_DEFECT","gate_verdict":"BLOCKED_ENVIRONMENT","required_findings":["Unavailable required evidence is not equivalent to passing evidence."],"forbidden_findings":["PASS","PASS_WITH_FINDINGS"]},"tags":["gate","environment","platform"]},
  {"id":"gate-006","category":"gate","title":"Non-blocking documentation issue allows pass with findings","severity":"normal","origin":"synthetic","input":{"prompt":"Audit this gate. All functional, oracle, and performance exit criteria pass. One README example still uses an old command name.","context":["The README example is explicitly outside the current gate exit criteria.","No user-facing contract or implementation behavior is affected."]},"expected":{"status":"READY_WITH_FINDINGS","earliest_untrusted_layer":null,"start_stage":"P34","required_stages":["P34"],"forbidden_stages":[],"authority_classification":[],"defect_classification":null,"gate_verdict":"PASS_WITH_FINDINGS","required_findings":["The finding is non-blocking because all current exit criteria are satisfied."],"forbidden_findings":["BLOCKED_EVIDENCE"]},"tags":["gate","pass-with-findings"]}
]
