[
  {"id":"authority-001","category":"authority","title":"Current architecture beats conflicting repository behavior","severity":"critical","origin":"synthetic","input":{"prompt":"The repository puts sync state inside the renderer, but the current architecture says the data runtime owns sync state. Which source should drive the fix?","context":["Architecture document is explicitly Current Authority.","Repository behavior is deployed but undocumented as a design decision."]},"expected":{"status":"READY_WITH_FINDINGS","earliest_untrusted_layer":"implementation","start_stage":"P22","required_stages":["P22","P35"],"forbidden_stages":["P23"],"authority_classification":["Current Authority: architecture document","Implementation Reality: repository behavior"],"defect_classification":"IMPLEMENTATION_DEFECT","gate_verdict":null,"required_findings":["Repository behavior does not override current architecture authority.","This is implementation or architecture drift unless a new authority change is accepted."],"forbidden_findings":["Promote the repository structure to architecture authority because it already exists."]},"tags":["implementation-reality","architecture-drift","critical"]},
  {"id":"authority-002","category":"authority","title":"Two current authorities that disagree block downstream work","severity":"critical","origin":"synthetic","input":{"prompt":"Spec A and Spec B are both marked Current Authority and disagree on operation ordering. Can we continue implementation?","context":["The disagreement changes replay semantics."]},"expected":{"status":"BLOCKED_AUTHORITY","earliest_untrusted_layer":"authority","start_stage":"P21","required_stages":["P21"],"forbidden_stages":["P30","P32"],"authority_classification":["AUTHORITY_CONFLICT"],"defect_classification":"AUTHORITY_CONFLICT","gate_verdict":null,"required_findings":["One effective authority must be established before downstream work continues."],"forbidden_findings":["Pick the newer file automatically without supersession evidence."]},"tags":["authority-conflict","ordering","critical"]},
  {"id":"authority-003","category":"authority","title":"Newer draft does not supersede older current authority","severity":"high","origin":"synthetic","input":{"prompt":"A draft v0.3 was edited yesterday, while v0.2 is still marked Current Authority. Which one should implementation follow?","context":["No accepted supersession exists."]},"expected":{"status":"READY_WITH_FINDINGS","earliest_untrusted_layer":"implementation","start_stage":"P21","required_stages":["P21"],"forbidden_stages":["P23"],"authority_classification":["Current Authority: v0.2","Draft/Proposed: v0.3"],"defect_classification":null,"gate_verdict":null,"required_findings":["Freshness does not make a draft current authority."],"forbidden_findings":["Use v0.3 because it was modified more recently."]},"tags":["draft","versioning"]},
  {"id":"authority-004","category":"authority","title":"Superseded document remains historical only","severity":"normal","origin":"synthetic","input":{"prompt":"An old RFC says batching is canonical, but its header says Superseded by the current operation-only model. Which rule is effective?","context":["The supersession link is explicit."]},"expected":{"status":"READY_WITH_FINDINGS","earliest_untrusted_layer":"implementation","start_stage":"P21","required_stages":["P21"],"forbidden_stages":["P23"],"authority_classification":["Superseded/Historical: old RFC","Current Authority: operation-only model"],"defect_classification":null,"gate_verdict":null,"required_findings":["The superseded RFC can explain history but cannot compete with current authority."],"forbidden_findings":["Treat both documents as equally authoritative."]},"tags":["supersession","historical"]},
  {"id":"authority-005","category":"authority","title":"Historical ADR cannot override current baseline","severity":"high","origin":"synthetic","input":{"prompt":"A historical ADR chose a native data runtime, but the current baseline says TS-first. The old ADR is more detailed. Which should we implement?","context":["Current baseline explicitly supersedes the old direction."]},"expected":{"status":"READY_WITH_FINDINGS","earliest_untrusted_layer":"implementation","start_stage":"P21","required_stages":["P21"],"forbidden_stages":["P23"],"authority_classification":["Superseded/Historical: native-runtime ADR","Current Authority: TS-first baseline"],"defect_classification":null,"gate_verdict":null,"required_findings":["Detail level does not outrank current authority status."],"forbidden_findings":["Prefer the old ADR because it contains more implementation detail."]},"tags":["adr","baseline","historical"]},
  {"id":"authority-006","category":"authority","title":"Stale tests are evidence drift, not authority","severity":"critical","origin":"synthetic","input":{"prompt":"The current semantic spec changed a field default, but old golden tests still enforce the previous default. The implementation matches the new spec and tests fail.","context":["The spec change was accepted and supersession is complete."]},"expected":{"status":"READY_WITH_FINDINGS","earliest_untrusted_layer":"verification","start_stage":"P22","required_stages":["P22","P35","P36"],"forbidden_stages":["P32"],"authority_classification":["Current Authority: semantic spec","Evidence: stale golden tests"],"defect_classification":"TEST_DEFECT","gate_verdict":null,"required_findings":["Tests must be updated to prove the current contract, not the superseded behavior."],"forbidden_findings":["Revert the implementation to make stale tests pass."]},"tags":["verification-drift","test-defect","critical"]},
  {"id":"authority-007","category":"authority","title":"Missing contract discovered during implementation blocks downstream work","severity":"critical","origin":"synthetic","input":{"prompt":"While implementing reconnect, we discovered that ordering across local and remote replay is not defined anywhere. Can Codex choose a reasonable ordering?","context":["The missing rule affects observable canonical state."]},"expected":{"status":"BLOCKED_AUTHORITY","earliest_untrusted_layer":"operation","start_stage":"P21","required_stages":["P21","P13","P20"],"forbidden_stages":["P32","P36"],"authority_classification":["MISSING_CONTRACT"],"defect_classification":"MISSING_CONTRACT","gate_verdict":null,"required_findings":["Codex must not invent canonical ordering semantics in implementation."],"forbidden_findings":["Choose the simplest ordering and document it afterward."]},"tags":["missing-contract","operation","critical"]},
  {"id":"authority-008","category":"authority","title":"Accepted new authority with stale master index requires supersession closure","severity":"high","origin":"synthetic","input":{"prompt":"Architecture v0.4 is accepted and marked Current, but the master index and implementation plan still point to v0.3. What is the correct next step?","context":["v0.3 is marked Superseded.","Downstream tasks have not been rebased."]},"expected":{"status":"BLOCKED_AUTHORITY","earliest_untrusted_layer":"authority","start_stage":"P23","required_stages":["P23","P22"],"forbidden_stages":["P32"],"authority_classification":["Current Authority: v0.4","Superseded/Historical: v0.3","Stale downstream reference: master/plan"],"defect_classification":"AUTHORITY_CONFLICT","gate_verdict":null,"required_findings":["Update master/index and downstream version dependencies before resuming implementation."],"forbidden_findings":["Continue because the new architecture document itself is already current."]},"tags":["supersession","stale-downstream","authority"]}
]
